<?xml version="1.0" encoding="UTF-8"?>
<Boundaries xmlns:xsi="http://www.w3.org/2001/XMLSchema-instance" xsi:noNamespaceSchemaLocation="BoundariesStateSchema.xsd">
  <UserName>UserName</UserName>
  <TimeInfo>
    <FileCreationTime>2001-12-31T12:00:00</FileCreationTime>
    <FileCreationUtime>0</FileCreationUtime>
  </TimeInfo>
  <Boundary>
    <BoundaryId>0</BoundaryId>
    <BoundaryType>BoundaryType</BoundaryType>
    <BoundaryMode>BoundaryMode</BoundaryMode>
    <BoundaryLifeSpan>0</BoundaryLifeSpan>
    <BoundaryCreationTime>2001-12-31T12:00:00</BoundaryCreationTime>
    <BoundaryCreationUtime>0</BoundaryCreationUtime>
    <BoundaryEditedTime>2001-12-31T12:00:00</BoundaryEditedTime>
    <BoundaryEditedUtime>0</BoundaryEditedUtime>
    <BoundaryExpirationTime>2001-12-31T12:00:00</BoundaryExpirationTime>
    <BoundaryExpirationUtime>0</BoundaryExpirationUtime>
    <NumberOfVertices>0</NumberOfVertices>
    <Vertex/>
  </Boundary>
  <ForbiddenBoundaryIds>
    <ForbiddenId>ForbiddenId</ForbiddenId>
  </ForbiddenBoundaryIds>
  <Log>
    <Comment>Comment</Comment>
  </Log>
</Boundaries>
